<?xml version="1.0" encoding="ISO-8859-1"?>
<!--

    Copyright (C) 2000 - 2013 Silverpeas

    This program is free software: you can redistribute it and/or modify
    it under the terms of the GNU Affero General Public License as
    published by the Free Software Foundation, either version 3 of the
    License, or (at your option) any later version.

    As a special exception to the terms and conditions of version 3.0 of
    the GPL, you may redistribute this Program in connection with Free/Libre
    Open Source Software ("FLOSS") applications as described in Silverpeas's
    FLOSS exception.  You should have received a copy of the text describing
    the FLOSS exception, and it is also available here:
    "http://www.silverpeas.org/docs/core/legal/floss_exception.html"

    This program is distributed in the hope that it will be useful,
    but WITHOUT ANY WARRANTY; without even the implied warranty of
    MERCHANTABILITY or FITNESS FOR A PARTICULAR PURPOSE.  See the
    GNU Affero General Public License for more details.

    You should have received a copy of the GNU Affero General Public License
    along with this program.  If not, see <http://www.gnu.org/licenses/>.

-->

<SilverpeasExchange xmlns="http://intranoo.oevo.com/websilverpeas/exchange/v5" xmlns:xsi="http://www.w3.org/2001/XMLSchema-instance" xsi:schemaLocation="http://intranoo.oevo.com/websilverpeas/exchange/v5 file:///opt/Silverpeas/SilverpeasExchange.xsd">
	<topicTrees>
		<topicTree componentId="kmelia16">
			<topic id="678">
				<name>1-Informations aux INTERNES</name>
				<description>Informations aux INTERNES</description>
				<topic id="679">
					<name>2-Test</name>
					<description>Test</description>
				</topic>
				<topic id="680">
					<name>3-Test</name>
					<description>Test</description>
				</topic>
			</topic>
		</topicTree>
		<topicTree componentId="kmelia16">
			<topic id="681">
				<name>2-Informations aux EXTERNES</name>
				<description>Informations aux EXTERNES</description>
				<topic id="681">
					<name>AAA</name>
					<description></description>
				</topic>
				<topic id="682">
					<name>BBB</name>
					<description></description>
				</topic>
			</topic>
		</topicTree>
	</topicTrees>	
</SilverpeasExchange>