<?xml version="1.0" encoding="UTF-8"?>
<!--

    Copyright (C) 2000 - 2013 Silverpeas

    This program is free software: you can redistribute it and/or modify
    it under the terms of the GNU Affero General Public License as
    published by the Free Software Foundation, either version 3 of the
    License, or (at your option) any later version.

    As a special exception to the terms and conditions of version 3.0 of
    the GPL, you may redistribute this Program in connection with Free/Libre
    Open Source Software ("FLOSS") applications as described in Silverpeas's
    FLOSS exception.  You should have received a copy of the text describing
    the FLOSS exception, and it is also available here:
    "http://www.silverpeas.org/docs/core/legal/floss_exception.html"

    This program is distributed in the hope that it will be useful,
    but WITHOUT ANY WARRANTY; without even the implied warranty of
    MERCHANTABILITY or FITNESS FOR A PARTICULAR PURPOSE.  See the
    GNU Affero General Public License for more details.

    You should have received a copy of the GNU Affero General Public License
    along with this program.  If not, see <http://www.gnu.org/licenses/>.

-->

<SilverpeasExchange targetComponentId="kmelia621" xmlns="http://intranoo.oevo.com/websilverpeas/exchange/v308" xmlns:xsi="http://www.w3.org/2001/XMLSchema-instance" xsi:schemaLocation="http://intranoo.oevo.com/websilverpeas/exchange/v5 http://intranoo.oevo.com/websilverpeas/exchange/v5/SilverpeasExchange.xsd">
	<publications>
		<publication>
			<publicationHeader>
				<name>Publication importï¿½e</name>
				<description>la description de la publication xml</description>
				<creationDate>2005-01-01</creationDate>
				<beginDate>2005-01-02</beginDate>
				<endDate>2006-01-03</endDate>
				<creatorId>98</creatorId>
				<importance>1</importance>
				<version>1.0</version>
				<keywords>publication castor xml</keywords>
				<status>Valid</status>
				<vignette>\\Silver-fs\documents\tests\lot2\logo_silverpeas.gif</vignette>
			</publicationHeader>
			<attachments>
				<attachment path="\\Silver-fs\documents\tests\lot2\dossier1\sousdossier\Tryptique.doc"/>
				<attachment path="\\Silver-fs\documents\tests\lot2\dossier2\MANUEL BDD.xls"/>
				<attachment path="\\Silver-fs\documents\tests\lot2\dossier2\logo_silverpeas.gif"/>
			</attachments>
			<topicPositions>
				<topicPosition topicId="289"/>
				<topicPosition topicId="290"/>
			</topicPositions>
			<pdcPositions>
				<pdcPosition>
					<axisPosition axisId="3" pdcValuePath="/0/2/9/"/>
					<axisPosition axisId="4" pdcValuePath="/0/1/"/>
				</pdcPosition>
				<pdcPosition>
					<axisPosition axisId="3" pdcValuePath="/0/1/4/6/"/>
					<axisPosition axisId="4" pdcValuePath="/0/3/"/>
				</pdcPosition>
			</pdcPositions>
		</publication>
	</publications>
</SilverpeasExchange>